{
  "schema_version": 1,
  "id": "sdr",
  "title": "SDR",
  "summary": "SDR team from Galaxy Day 2 livestream.",
  "version": "3.1.0",
  "tags": ["sdr"],
  "sources": ["https://x.com/i/broadcasts/1PKqrNyvmYwGb"],
  "principles": [],
  "roles": [
    {
      "id": "chief-of-staff",
      "name": "Chief of Staff",
      "kind": "orchestrator",
      "reports_to": null,
      "summary": "Coordinates the SDR team.",
      "persona": "",
      "in_scope": [],
      "out_of_scope": [],
      "required": true
    },
    {
      "id": "enrichment",
      "name": "Enrichment",
      "kind": "specialist",
      "reports_to": "chief-of-staff",
      "summary": "Data enrichment.",
      "persona": "",
      "in_scope": [],
      "out_of_scope": [],
      "required": true
    }
  ],
  "channels": [],
  "handoffs": [],
  "spawn": {
    "prefer_current_agent_as": "chief-of-staff",
    "reuse_matching_by_name": true,
    "do_not_fanout_until_first_goal": true,
    "secrets": "vault_only"
  }
}
