{
  "schema_version": 1,
  "id": "game-studio",
  "title": "Game Studio",
  "summary": "Game studio team from Galaxy Day 2 livestream.",
  "version": "3.0.0",
  "tags": ["game-studio", "gaming"],
  "sources": ["https://x.com/i/broadcasts/1PKqrNyvmYwGb"],
  "principles": [],
  "roles": [
    {
      "id": "chief-of-staff",
      "name": "Chief of Staff",
      "kind": "orchestrator",
      "reports_to": null,
      "summary": "Coordinates the game studio team.",
      "persona": "",
      "in_scope": [],
      "out_of_scope": [],
      "required": true
    },
    {
      "id": "creative-director",
      "name": "Creative Director",
      "kind": "specialist",
      "reports_to": "chief-of-staff",
      "summary": "Creative direction and vision.",
      "persona": "",
      "in_scope": [],
      "out_of_scope": [],
      "required": true
    },
    {
      "id": "founding-engineer",
      "name": "Founding Engineer",
      "kind": "specialist",
      "reports_to": "chief-of-staff",
      "summary": "Game development and technical implementation.",
      "persona": "",
      "in_scope": [],
      "out_of_scope": [],
      "required": true
    },
    {
      "id": "growth-engineer",
      "name": "Growth Engineer",
      "kind": "specialist",
      "reports_to": "chief-of-staff",
      "summary": "Growth and outreach engineering.",
      "persona": "",
      "in_scope": [],
      "out_of_scope": [],
      "required": true
    },
    {
      "id": "3d-prototyping",
      "name": "3D Prototyping",
      "kind": "specialist",
      "reports_to": "chief-of-staff",
      "summary": "3D modeling and asset creation.",
      "persona": "",
      "in_scope": [],
      "out_of_scope": [],
      "required": true
    },
    {
      "id": "image-gen",
      "name": "Image Gen",
      "kind": "specialist",
      "reports_to": "chief-of-staff",
      "summary": "Image generation.",
      "persona": "",
      "in_scope": [],
      "out_of_scope": [],
      "required": true
    },
    {
      "id": "game-designer",
      "name": "Game Designer",
      "kind": "specialist",
      "reports_to": "chief-of-staff",
      "summary": "Game mechanics and systems design.",
      "persona": "",
      "in_scope": [],
      "out_of_scope": [],
      "required": true
    },
    {
      "id": "designer",
      "name": "Designer",
      "kind": "specialist",
      "reports_to": "chief-of-staff",
      "summary": "Visual design and UI/UX.",
      "persona": "",
      "in_scope": [],
      "out_of_scope": [],
      "required": true
    },
    {
      "id": "audio-engineer",
      "name": "Audio Engineer",
      "kind": "specialist",
      "reports_to": "chief-of-staff",
      "summary": "Audio, music, and sound effects.",
      "persona": "",
      "in_scope": [],
      "out_of_scope": [],
      "required": true
    },
    {
      "id": "intern",
      "name": "Intern",
      "kind": "specialist",
      "reports_to": "chief-of-staff",
      "summary": "Team support.",
      "persona": "",
      "in_scope": [],
      "out_of_scope": [],
      "required": true
    },
    {
      "id": "ops",
      "name": "Ops",
      "kind": "specialist",
      "reports_to": "chief-of-staff",
      "summary": "Operations.",
      "persona": "",
      "in_scope": [],
      "out_of_scope": [],
      "required": true
    }
  ],
  "channels": [],
  "handoffs": [],
  "spawn": {
    "prefer_current_agent_as": "chief-of-staff",
    "reuse_matching_by_name": true,
    "do_not_fanout_until_first_goal": true,
    "secrets": "vault_only"
  }
}
